title,body,date,n_paragraphs
Ministra argentina cuestiona justicia en Mxico si el crimen controla elecciones de jueces,Ciudad de Mxico  nov EFE La ministra de seguridad de Argentina Patricia Bullrich critic este viernes la reforma al Poder Judicial en Mxico que busca la eleccin popular de los jueces al cuestionar qu justicia habr en las zonas controladas por el crimen Qu pasara aqu en Mxico si esa reforma de la justicia permite que en zonas controladas por el narcotrfico se voten jueces que responden al narcotrfico seal Bullrich en el Foro Amrica Libre organizado por la derecha mexicana De qu justicia estamos hablando qu jueces puede haber en aquellos lugares donde el territorio est dominado por el narcotrfico agreg la ministra argentina sobre la reforma impulsada por la actual presidenta mexicana Claudia Sheinbaum Bullrich apunt que esa no es la tradicin republicana sino un intento de control social Durante su ponencia en la capital mexicana la representante del Gobierno argentino plante que sin seguridad el Estado de derecho se debilita y la libertad de las personas deja de ser una realidad para convertirse tan solo en una aspiracin Seal que cuando los pases dejan que el narcotrfico y las bandas criminales avancen lo hacen porque es la manera de someter a los pueblos Es la manera de destruir las democracias y es la manera de construir autocracias que se quedan en el poder advirti la excandidata a la Presidencia argentina en  Por ello dijo Bullrich en Argentina han apostado por el combate al crimen organizado en todos sus niveles lo cual esperan contagiar al continente El miedo es el enemigo principal de la libertad por eso nosotros hoy estamos construyendo libertad y estamos hacindolo en un combate de frente contra el crimen organizado contra el delito en nuestro pas afirm la ministra de Seguridad que ocup el mismo cargo en el Gobierno del expresidente Mauricio Macri  Bullrich presumi una reduccin del   en los homicidios durante el Gobierno del actual presidente Javier Milei y afirm que Argentina es la segunda nacin ms segura en la regin tan solo despus de El Salvador La ministra destac adems la ley antimafia en su pas con la que afirm estn generando un nuevo paradigma para extraer a crimen organizado de las estructuras de poder Siempre estamos del lado de las vctimas y nunca de los delincuentes Es el mandato que tenemos para restablecer la ley y la confianza por la ley perdida durante muchos aos en un pas con mafias como la Argentina que las estamos combatiendo todos los das sostuvo Bullrich En su segunda edicin este ao el Foro Amrica Libre reuni del  al  de noviembre representantes de  pases en la capital mexicana en busca ser un contrapeso al Foro de Sao Paulo que congrega a la izquierda latinoamericana,8 de noviembre de 2024,13
El  de los abortos que se practican en la Comunidad de Madrid se realizan en clnicas privadas,El nmero de Interrupciones Voluntarias del Embarazo IVE en la Comunidad de Madrid durante  ha ascendido  un  ms respecto al ao anterior cuando se registraron  IVE Ms de la mitad de los casos el  han sido motivados por la falta de mtodos anticonceptivos Segn los datos difundidos este lunes por el Instituto de Estadstica de la CAM el  del total de las intervenciones se han realizado en centros privados y un  se han llevado a cabo en los centros pblicos madrileos En la sanidad privada el  de los casos han sido a peticin de la mujer mientras que en la pblica el porcentaje de mujeres que deciden hacerlo apenas supera el  Del total de IVE el  se han realizado por este motivo Al tiempo las interrupciones motivadas por grave riesgo para la vida o la salud de la embarazada han ascendido un  el  de estos casos se han realizado en centros pblicos Adems la Comunidad de Madrid registr en  la segunda tasa ms alta de toda Espaa de interrupciones voluntarias con  por cada mil mujeres lo que supone ms de un punto ms que hace un ao cuando se colocaba en el  segn el Registro Estatal de Interrupciones Voluntarias del Embarazo publicado por el Ministerio de Sanidad Slo Catalua supera a Madrid en tasa de abortos voluntarios en  con con  por cada  mujeres En el conjunto de Espaa el nmero de IVE alcanz las   ms que en  se registraron  entonces lo que representa un aumento del  por ciento en un ao y del  por ciento con respecto a  cuando se registraron  abortos voluntarios A nivel nacional la tasa de interrupciones voluntarias del embarazo ha ascendido al  con Catalua  Baleares  Madrid  y Asturias  a la cabeza del ranking Adems Estadstica ha sealado que ms de la mitad de las mujeres que se sometieron a una interrupcin voluntaria del embarazo en Madrid el  no haban usado mtodos anticonceptivos durante sus relaciones sexuales En concreto entre las mujeres que han llevado a cabo una interrupcin de embarazo en  el grupo de edad que ms se abstuvo a la utilizacin de anticonceptivos ha sido el de mujeres de  aos o ms  seguido del de adolescentes menores de  aos con un  En el lado contrario el grupo de edad que va de los  a los  aos ha sido el que ha anotado una menor tasa de IVE por la no utilizacin de anticonceptivos  seguido de las mujeres de  a  aos  En  el  de las mujeres que interrumpieron su embarazo utilizaron anticonceptivos de barrera y un  emplearon anticonceptivos hormonales Los datos del Ministerio de Sanidad recogidos por el Instituto de Estadstica tambin desprenden que el  de las interrupciones de embarazo en la regin  se llevaron a cabo en las  primeras semanas de gestacin la mayora en centros privados  mientras que slo el  se produjo ms all de la vigsimo tercera semana el  en centros pblicos Atendiendo a la edad de la mujer en el momento de la interrupcin se ha observado una concentracin de las interrupciones en las edades comprendidas entre los  y los  aos el  del total Asimismo analizando el nivel de estudios alcanzado destacan las mujeres con bachillerato y ciclos de FP que ascendieron al  de los casos y ESO y equivalentes con un  del total Estadstica tambin ha sealado que se producen ms interrupciones voluntarias del embarazo cuando la mujer tiene actualmente hijos vivos  de los casos y sin ningn aborto anterior  y que el porcentaje de interrupciones voluntarias del embarazo es mayor en el caso de mujeres que tienen hijos a su cargo sean o no biolgicos y que viven en pareja  Por otro lado en la mayora de las interrupciones llevadas a cabo en la regin el  el lugar donde se inform por primera vez de la posibilidad de interrumpir el embarazo fue un centro sanitario pblico Ms all del entorno sanitario otras fuentes a las que han recurrido las mujeres madrileas a la hora de decidir interrumpir su embarazo han sido Internet  y amigos o familiares  A nivel regional los municipios de ms de  habitantes que han registrado un mayor nmero de Interrupciones Voluntarias de Embarazo durante  han sido Madrid  seguido de Mstoles  Alcal de Henares  y Fuenlabrada  Solo respondemos ante socios y socias ante personas como t que creen que nuestro trabajo importa Por eso si nos lees habitualmente y crees en el periodismo con valores pedimos tu colaboracin para que podamos seguir siendo independientes  Te llevar menos de un minuto y puedes hacerlo desde aqu con cuotas que van desde   al mesAunque parezca una cantidad pequea sumada a las de muchas ms personas es lo que hace posible que existamosMuchas personas con pequeas decisiones pueden hacer grandes cosasHaz posible el periodismo independiente En el otro lado Tres Cantos  Boadilla del Monte  Arganda del Rey Colmenar Viejo y Pinto en los tres municipios  casos han sido los que menos IVE han anotado en el ao  En total los ayuntamientos madrileos de ms de  habitantes han sumado  interrupciones los de  a  habitantes han anotado  casos y finalmente los de menos de  habitantes han registrado  casos de mujeres que han interrumpido su embarazo de manera voluntaria,4 de noviembre de 2024,18
PP Madrid acusa al Gobierno de culpar a Casa Real de lo sucedido en Paiporta afea que Snchez se fuera y ensalza al Rey,Ms Madrid condena la agresin a Snchez mientras PSOE ve un linchamiento contra el presidente MADRID  EUROPA PRESS El portavoz del PP en la Asamblea de Madrid Carlos DazPache ha acusado al Gobierno central de culpar a la Casa Real de las situaciones de tensin vividas en Paiporta ha criticado que el presidente del Gobierno Pedro Snchez abandonara el lugar y ha ensalzado al Rey Felipe VI que aguant ah estoicamente con los afectados Ayer lo que vimos fue el hartazgo de personas que estn en una situacin del lmite que lo han perdido todo y que en esos nervios pues desde luego se expresaban ha descrito DazPache en la rueda de prensa posterior a la Junta de Portavoces de este lunes El domingo visitaron Paiporta una de las localidades ms afectadas por la DANA los Reyes Felipe VI y Letizia Ortiz Pedro Snchez y el presidente de la Generalitat Valenciana Carlos Mazn All fueron recibidos por parte de los congregados con lanzamiento de barro e insultos mientras que Snchez fue golpeado El ministro del Interior Fernando GrandeMarlaska aseguraba esta maana que haba un mnimo de organizacin entre los protagonistas de los altercados esperaba que la Guardia Civil localice a los agresores del presidente y explicaba que el dispositivo de seguridad fue llevado a cabo por Casa Real Creo que no es momento de reproches pero desde luego la inoperancia de Pedro Snchez en general y en este caso particular el presidente del Gobierno que trata a una comunidad autnoma como si fuera un Estado independiente al que puede ayudar como si fuera un tercer pas pues creo que no es el mejor ejemplo ha lanzado DazPache quien ha reivindicado a Felipe VI amparando y consolando a las vctimas MS MADRID CONDENA LOS ATAQUES Y PSOE VE LINCHAMIENTO Por su parte la portavoz de Ms Madrid en la Cmara Manuela Bergerot ha condenado los ataques a las autoridades en su visita a Paiporta y especialmente los de grupos de extrema derecha contra el presidente del Gobierno Comprendemos la indignacin de muchos ciudadanos ante una visita no oportuna cuando la prioridad era continuar con los trabajos de desescombro y bsqueda pero la dureza de la situacin no puede ser excusa para promover la violencia ha planteado El secretario del PSOEM Juan Lobato considera que ha habido un linchamiento a Pedro Snchez que se lleva viendo muchos meses en muchos sitios y diferentes mbitos y cree que muestra de ello es lo ocurrido el fin de semana Cree que ayer haba en esa marabunta gente de todo el espectro poltico y que el trabajo de los polticos muchas veces pasa por tener esa empata y esa capacidad para organizar todo lo que podemos para ayudarles Creo que eso est haciendo el gobierno de Espaa creo que eso est haciendo todos los gobiernos yo no dudo de nadie y adems creo que no tocan los reproches  esa frustracin pues claro que la entiendo cmo la voy a entender Escuchamos ayer a los Reyes que por cierto yo creo que estuvieron de  de  yendo all escuchando dando la cara a una situacin muy complicada y pues trasladando ese apoyo y esa empata que dice pero es til o no es til pues siempre es til ha expuesto el lder de los socialistas La portavoz de Vox Isabel Prez Moino ha descrito las imgenes de Paiporta como el grito de desesperacin de un pueblo que se ha sentido abandonado como consecuencia de una hipertrofia administrativa que no han sabido resolver,4 de noviembre de 2024,14
El Real Madrid intenta esquivar la querella vecinal echando culpas del ruido del Bernabu a los promotores de eventos,El frente judicial para el Real Madrid por el ruido de sus conciertos en su estadio ha quedado abierto Este martes se celebraba la primera vista por la querella que la Asociacin Vecinal de Perjudicados por el Bernabu haba interpuesto contra el club merengue a la que acuda la mano derecha de Florentino Prez Jose ngel Snchez Segn fuentes presentes en la vista que han sido consultadas por este peridico JAS ha intentado junto al director de infraestructuras del Real Madrid Francisco Panadero desviar las culpas por el ruido y durante su comparecencia se ha centrado en responsabilizar de las superaciones sonoras a los promotores de los conciertos Incluso en algn momento ha responsabilizado a cantantes que no quisieron bajar el volumen de sus altavoces El club blanco ha esgrimido como prueba las multas por valor de  euros impuestas por el Ayuntamiento a los promotores de los conciertos por los eventos en los que se superaron los niveles sonoros permitidos legalmente por la ordenanza municipal Tambin han afirmado en su defensa que el estadio de los de Florentino Prez es el estadio mejor insonorizado de Europa Pese a ello el Real Madrid ha suspendido todos los conciertos en su estadio hasta la primavera del ao que viene mientras ejecuta obras para reducir los niveles de ruido Expertos consultados por Somos Madrid advirtieron que este encapsulamiento es casi imposible y que es muy probable que las futuras actuaciones musicales sigan saltndose los lmites sonoros Los vecinos por su parte han denunciado que el ruido que generan los conciertos es  veces al mximo permitido Estamos en esta situacin porque alguien ha tomado la mala decisin de intentar hacer un modelo de negocio que no es legal porque ni se puede hacer conciertos en el estadio porque no tiene licencia para ello y adems no est insonorizado Es un disparate ha subrayado un portavoz vecinal a la salida de la vista en declaraciones recogidas por Europa Press Ha detallado que desde la asociacin se han ejecutado  mediciones de ruido en los  conciertos que ha habido superndose en todos ellos los niveles de una media bestial como se deca de promedio ms de  veces Los vecinos argumentan en su demanda a Real Madrid Estadio la empresa que alquila el coso blanco para eventos que la responsabilidad sobre la emisin de ruidos es el propio club de ftbol y no los promotores al igual que la sentencia por el ruido del aeropuerto de Barajas recay sobre Aena y no sobre los aviones que usaban sus pistas y provocaban el ruido La jornada de hoy es el primer peldao de una larga escalera que tendr que subir el Real Madrid hasta saber si consigue esquivar o no este nuevo frente abierto en el Juzgado de Instruccin nmero  de Madrid La denunciante Asociacin Vecinal de Perjudicados por el Bernabu mantiene que los conciertos que se celebran en el estadio desde el pasado  de julio implican el incumplimiento de la licencia urbanstica que obliga a adoptar medidas de insonorizacin Para el portavoz vecinal no se trata de un problema de ftbol ni un problema del Real Madrid sino un problema de salud pblica Se est generando un dao a la salud de miles de ciudadanos pero no hay que olvidar que alrededor del Bernabu solo en la zona que podramos llamar zona cero hay del orden de  viviendas o sea unos  y pico personas viviendo que han sufrido problemas serios ha agregado Recibe las noticias ms importantes de Madrid con un boletn escrito para ti todos los viernes en tu correo Apntate aqu y recbelas junto a los mejores planes para el fin de semana Tambin puedes seguirnos desde tu red social preferida en Facebook TwitterX o Instagram,29 de octubre de 2024,10
LaLiga denunciar los insultos racistas contra Lamine Yamal y Raphinha y el Real Madrid anuncia medidas disciplinarias,LaLiga denunciar las intolerables conductas racistas contra los futbolistas del FC Barcelona Lamine Yamal y Raphinha por parte de algunos aficionados del Real Madrid presentes en el Santiago Bernabu en el partido de ftbol que ambos equipos disputaron este sbado Por su parte el Real Madrid ha anunciado que adoptar medidas disciplinarias y judiciales contra los responsables de lo ocurrido Durante el partido de LaLiga en el estadio madridista Lamine Yamal recibi insultos tras marcar el  cuando se pudieron escuchar expresiones ofensivas como moro de mierda puto negro puto moro mena de mierda o a vender pauelos a un semforo Ante los hechos ocurridos durante el transcurso del partido Real MadridFC Barcelona en el que se observaron intolerables conductas racistas LaLiga denunciar de forma inmediata los insultos y gestos racistas recibidos por los jugadores del FC Barcelona ante la Seccin de Odio de la Brigada de Informacin de la Polica Nacional informando de ello al Excelentsimo Fiscal de Sala Coordinador de la Unidad de Delitos de Odio y Discriminacin de la Fiscala General del Estado ha sealado LaLiga en un comunicado Adems la patronal ha condenado enrgicamente estos hechos LaLiga contina firme en su compromiso de erradicar cualquier tipo de conducta racista y odio dentro y fuera de los estadios En el deporte no hay lugar para esta lacra apunta Solo respondemos ante socios y socias ante personas como t que creen que nuestro trabajo importa Por eso si nos lees habitualmente y crees en el periodismo con valores pedimos tu colaboracin para que podamos seguir siendo independientes  Te llevar menos de un minuto y puedes hacerlo desde aqu con cuotas que van desde   al mesAunque parezca una cantidad pequea sumada a las de muchas ms personas es lo que hace posible que existamosMuchas personas con pequeas decisiones pueden hacer grandes cosasHaz posible el periodismo independiente Por su parte el Real Madrid tambin ha condenado los insultos racistas a los jugador culs y anunciado medidas legales El Real Madrid condena de manera rotunda cualquier tipo de comportamiento que implique racismo xenofobia o violencia en el ftbol y en el deporte y lamenta profundamente los insultos que unos pocos aficionados profirieron anoche en uno de los crners del estadio subraya en un comunicado El Real Madrid ha abierto una investigacin a fin de localizar e identificar a los autores de estos lamentables y deleznables insultos para poder adoptar las medidas disciplinarias y judiciales pertinentes concluye,27 de octubre de 2024,7
Ms Madrid cesa a Arenillas tras su negativa a dimitir por unas explicaciones que no se corresponden con la realidad,MADRID  EUROPA PRESS Ms Madrid ha cesado a la diputada Loreto Arenillas tras su negativa a dimitir por unas explicaciones en torno a un presunto caso de violencia sexual protagonizado por el exportavoz de Sumar igo Errejn que no se corresponden con la realidad conocida en los ltimos das y horas HABR AMPLIACIN,25 de octubre de 2024,3
Dellafuente cambia el Bernabu por dos Metropolitanos para compensar el concierto cancelado por el Real Madrid,Nueva vctima musical por la paralizacin de los conciertos en el Santiago Bernabu El msico Pablo Enoc ms conocido como Dellafuente ha anunciado que su gran actuacin en Madrid prevista para el  de noviembre en el estadio del Real Madrid se celebrar finalmente en el Metropolitano Da igual dnde da igual cundo lo importante es con quin ha compartido en sus redes el exitoso artista granadino Una frase con la que anima a sus fans a asistir a dos conciertos aprovecha el cambio para aadir una segunda fecha que tendrn lugar los prximos  y  de junio ya en  La preventa para la segunda fecha se activar el jueves  de noviembre a partir de las  previa inscripcin en este enlace En esa fecha las personas inscritas recibirn un mail con un link de compra y un cdigo nico que permitir acceder a la venta de entradas en ese mismo momento El aplazamiento de la fecha inicial se debe a causas completamente ajenas a la voluntad tanto de Dellafuente como de la organizacin indica la promotora Maas en la nota de prensa La decisin de suspender los eventos musicales en el recinto la tom el propio club presidido por Florentino Prez despus de las continuas quejas por rebasar los lmites de ruido permitidos algo que qued acreditado y ha supuesto multas del Ayuntamiento por ms de  euros a las entidades promotoras de los conciertos celebrados A ello se han sumado despus problemas derivados de la licencia con la que se celebraron los conciertos Este movimiento atiende a una de las principales peticiones del pblico desde que se anunci el show una segunda noche Una nueva oportunidad para las casi  personas que intentaron conseguir entradas la ltima vez las cuales se agotaron en menos de una hora explican desde la promotora Consideran el anuncio una muestra de la capacidad de Dellafuente para reinventarse y superar desafos Los promotores aprovechan para alardear de las bondades del nuevo espacio escogido al que ya se refieren con su nuevo patrocinio Riyadh Air Metropolitano Uno de los recintos de referencia nacional y europea acoger como estaba previsto un espectculo pionero en su planteamiento un show con diseo  y una direccin creativa innovadora la altura de una fecha tan especial Una altura a la que en esta ocasin el Bernabu no ha podido o no ha sabido estar Recibe las noticias ms importantes de Madrid con un boletn escrito para ti todos los viernes en tu correo Apntate aqu y recbelas junto a los mejores planes para el fin de semana Tambin puedes seguirnos desde tu red social preferida en Facebook TwitterX o Instagram,23 de octubre de 2024,7
Cambian las fronteras entre Madrid y Rivas a los lmites que marca la M dentro del pacto por la Caada Real,Las fronteras de Madrid se mueven Los ayuntamientos de la capital y de Rivas Vaciamadrid aprueban este jueves un cambio en sus trminos municipales para adecuar sus lmites a lo acordado en el Pacto Regional por la Caada Real Galiana suscrito en  entre la Delegacin del Gobierno en Madrid la Comunidad de Madrid y los citados municipios adems del de Coslada El cambio implica que la carretera M marque los lmites de ambos municipios y establezca una frontera fsica que hasta ahora no coincida con la geogrfica Rivas entrega a Madrid unos terrenos al norte de la A con una superficie de  m y la capital regional hace lo propio con otro terreno triangular al tambin al norte de la A de  m adems de otras parcelas de  m al sur de esta autova Por ambos lugares discurre la Caada Real Despus de su aprobacin el expediente ser sometido a informacin pblica durante un mes Luego ambos ayuntamientos debern responder a las alegaciones y aprobarlo en pleno por mayora absoluta Y la alteracin de los trminos municipales ser avalada previsiblemente por el Consejo de Gobierno de la Comunidad de Madrid Con el cambio aprobado tambin se modifica el reparto competencial sobre tres de los seis sectores de la Caada Real Galiana de la siguiente manera Para facilitar a los residentes en la zona las gestiones por el cambio de municipio se constituir un grupo de trabajo mixto entre los dos consistorios que recalcan en una nota conjunta la buena sintona con la que han venido trabajando ambos ayuntamientos especialmente sus equipos de urbanismo La alcaldesa de Rivas Vaciamadrid Ada Castillejo IU celebra que el acuerdo pueda ayudar a las familias de uno y otro lado de la M para que puedan vivir con dignidad Tambin anuncia que el terreno ganado para su localidad ser dedicado a desplegar un parque natural y zonas verdes Los ayuntamientos de Madrid y de Rivas Vaciamadrid suscribieron el  de mayo de  el Pacto Regional por la Caada Real junto con la Delegacin del Gobierno de Madrid la Comunidad de Madrid y el Ayuntamiento de Coslada Ese acuerdo incluy como anexo la propuesta de modificacin de trminos municipales En enero de  ambos consistorios suscribieron un protocolo que defina el intercambio de suelo en el mbito de la Caada Sectores   y  En marzo de  se inici el primer expediente para la solicitud a la Comunidad de Madrid de la alteracin del trmino municipal Sin embargo durante la tramitacin del expediente Rivas Vaciamadrid replante los trminos iniciales de la propuesta para incorporar nuevos suelos de Madrid debido a que el consistorio ripense dispona de un suelo previsto para un nuevo cementerio que como consecuencia de la redelimitacin inicial pasara a quedar dentro del trmino municipal de Madrid Adems de incluirlo en el trmino de Rivas este ayuntamiento requiri de un suelo adicional de Madrid para construir un nuevo acceso a la va de servicio de la A Esta solicitud fue planteada por el anterior alcalde de Rivas Vaciamadrid mediante carta en noviembre de  Ese mismo mes Ayuntamiento de Madrid acept este planteamiento trasladando en el mes de diciembre una nueva propuesta geogrfica elaborada la Direccin General de Planificacin Estratgica El segundo expediente con la ampliacin propuesta que ahora es elevado a la Comunidad de Madrid se inici formalmente en febrero de  Recibe las noticias ms importantes de Madrid con un boletn escrito para ti todos los viernes en tu correo Apntate aqu y recbelas junto a los mejores planes para el fin de semana Tambin puedes seguirnos desde tu red social preferida en Facebook TwitterX o Instagram,24 de octubre de 2024,9
