title,body,date,n_paragraphs
Los negocios del cambio climtico tras el impacto de la DANA en Valencia,Las lluvias torrenciales en el levante de la Pennsula Ibrica conocidas popularmente como gotas fras son habituales a finales de verano e inicios de otoo cuando las aguas del Mar Mediterrneo estn especialmente clidas En este contexto segn los primeros estudios cientficos la intensidad de la dana que impact fuertemente en Valencia el  de octubre habra aumentado cerca de un  por el cambio climtico El resultado fueron lluvias torrenciales de cerca de  litros por metro cuadrado en ocho horas Es decir toda lo que suele llover en un ao cay en unas pocas horas Adems la probabilidad de que ocurriera este evento meteorolgico extremo se habra doblado por el calentamiento global Es esto sorprendente No desde la comunidad cientfica venimos avisando desde hace aos de que el cambio climtico est aumentando la intensidad y la frecuencia de eventos meteorolgicos extremos como huracanes sequas y lluvias torrenciales De hecho los eventos meteorolgicos extremos se han multiplicado por cinco en los ltimos  aos Los eventos meteorolgicos extremos mal gestionados antes durante y despus de que sucedan suelen derivar en catstrofes humanitarias Esto es lo que ha sucedido con la dana que ha afectado a Valencia En este contexto suelen ser necesarias medidas de reconstruccin de carreteras vas frreas pasarelas peatonales calles mobiliario urbano centros educativos polgonos industriales viviendas etc Tras la devastacin producida por la dana en Valencia se estima que solo la reparacin de carretas y vas de tren ascender a ms de  millones de euros Dinero pblico est siendo destinado a reconstruir cuando podra ir a mejorar por ejemplo nuestros servicios pblicos Adems en algunas ocasiones se llevan a cabo grandes obras que no estaban previstas para evitar que sucedan catstrofes en el futuro como podra ser el desvo de cauces fluviales para evitar inundaciones en zonas urbanas o la construccin de diques para evitar inundaciones costeras por la subida del nivel del mar Es decir las consecuencias del cambio climtico abren nuevos ciclos de inversin en la adaptacin a dicho cambio climtico y de reconstruccin de las zonas afectadas por este Medidas de adaptacin y reconstruccin que pueden conllevar la emisin de grandes cantidades de gases de efecto invernadero que sigan alimentando el cambio climtico La mayora de estas actuaciones de adaptacin y reconstruccin son financiadas con fondos pblicos por las administraciones y muchas de ellas conllevan proyecto millonarios a los que solo pueden acceder grandes empresas tpicamente del sector de la construccin Como vemos las consecuencias del cambio climtico generan enormes inversiones pblicas que a su vez son ganancias multimillonarias para grandes empresas multinacionales Es ms muchos de los sper ricos y grandes grupos de inversin que financian empresas altamente contaminantes habitualmente relacionadas con los combustibles fsiles tambin invierten en las grandes empresas de la adaptacin y reconstruccin del cambio climtico Al tiempo que ganan mucho dinero impulsando el cambio climtico se forran hacindole frente Tanto es as que el capital movilizado en adaptacin y reconstruccin si no frenamos ya el cambio climtico ser mucho mayor que el que habra que invertir ahora para frenarlo Como corolario de este anlisis podemos decir que hay una minora de sper ricos que no querran parar el cambio climtico porque ganan mucho dinero con l y adems les afecta mucho menos que a la gente trabajadora porque por ejemplo no viven en zonas inundables y adems tienen helicpteros y jets privados para huir cuando quieran Por lo tanto ya sabemos para quin trabajan los negacionistas Frente al ciclo demoledor de inversiones alrededor del cambio climtico cada vez somos ms en la comunidad cientfica quienes apostamos por repartir riquezas para que la mayora de la poblacin vivamos mejor al tiempo que frenamos el crecimiento econmico continuo y acelerado propio de la economa capitalista Una economa que est chocando contra los lmites biofsicos del planeta colisin global que se expresa localmente por ejemplo en eventos meteorolgicos extremos muy intensos extensos y frecuentes El tndem repartir riquezas y decrecer significa por ejemplo eliminar construcciones de zonas inundables donde deben restaurarse ecosistemas que nos ofrezcan numerosos servicios de abastecimiento regulacin y culturales y aumenten la resilencia a impactos futuros Este es el caso de la restauracin ecolgica de los cauces fluviales sus llanuras aluviales y las marismas para evitar inundaciones El tndem repartir riquezas y decrecer significa por ejemplo que los sper ricos dejen ya de volar en jets privados para evitar entrar en la fase de cambio climtico abrupto Jess Castillo es Catedrtico de Ecologa en la Universidad de Sevilla y autor de Los negocios del cambio climtico Editorial Virus A travs de nuestro canal en Telegram trasladamos de forma inmediata lo que ocurre en Andaluca ltimas noticias que van aconteciendo o donde simplemente te ofrecemos un resumen de la informacin ms relevante del da Suscrbete a nuestro canal en este enlace,7 de noviembre de 2024,14
Expertos  de la Macaronesia debaten en La Palma estrategias de concienciacin sobre el cambio climtico,El Cabildo de La Palma ha organizado la segunda edicin del Encuentro Atlntico para la Educacin Ambiental en el que expertos en conservacin de la naturaleza de los archipilagos macaronsicos Madeira Canarias y Azores debaten sobre estrategias y retos para una concienciacin sobre el cambio climtico Las jornadas que se desarrollan en Santa Cruz de La Palma este jueves y el viernes consistirn en ponencias y mesas de trabajo en las que participan especialistas portugueses y espaoles en el desarrollo de propsitos competencias y marcos operativos de la educacin ambiental en la sociedad actual El investigador del comit de expertos para el estudio de Cambio Climtico en Canarias de la Universidad de Las Palmas de Gran Canaria Aridane Gonzlez considera que se necesita divulgar y transferir la ciencia que se desarrolla en los centros de investigacin a la sociedad general empezando por la educacin obligatoria Gonzlez ha asegurado que los programas educativos tienen que incluir de forma directa y transversal los impactos riesgos y vulnerabilidades a los que est sometida la sociedad en trminos climticos El doctor en Ciencias del Mar ha sealado que aunque llevamos aos y aos haciendo hincapi desde la comunidad cientfica la sociedad sigue confundiendo trminos y no dando la importancia que tienen los impactos del cambio climtico Gonzlez ha recomendado acudir a cientficos y datos oficiales para discutir el negacionismo contra el cambio climtico reiterando que en Canarias tenemos acceso a informacin pblica de grupos de investigacin punteros que no debemos poner en duda porque lo que marca la diferencia entre una opinin y la ciencia son los datos El presidente del Cabildo de La Palma Sergio Rodrguez ha coincidido con la opinin del experto afirmando que la nica manera de combatir la incredulidad de determinadas cuestiones es lo objetivo es decir los datos Adems solo hay que ver las circunstancias que manejamos en el da a da para ver los efectos del cambio climtico ha proseguido Rodrguez poniendo como ejemplo el incendio urbanoagrcola que sufri el municipio de El Paso en agosto de  tras una ola de calor con temperaturas que superaron los  grados en el interior de La Palma El presidente insular tambin ha agradecido a los ponentes su presencia en el Encuentro Atlntico y ha reiterado el compromiso del Cabildo de La Palma por la educacin como el instrumento ms potente para trasladar a la sociedad la necesidad del cuidado del medio ambiente,7 de noviembre de 2024,9
ONU Los pases deben aumentar drsticamente su adaptacin al cambio climtico,Nairobi  nov EFE Los pases deberan aumentar drsticamente sus esfuerzos de adaptacin al cambio climtico para hacer frente a los crecientes impactos medioambientales advirti este jueves el Programa de las Naciones Unidas para el Medioambiente PNUMA La medida ms urgente para hacerlo es que los pases ricos se comprometan a aumentar la financiacin para aquellos en vas de desarrollo en la Cumbre de la ONU para el Cambio Climtico COP el principal foro poltico sobre el clima que se celebrar en la capital de Azerbaiyn Bak entre los prximos  y  de noviembre As lo pidi el PNUMA con sede en Nairobi en la novena edicin de su Informe sobre la Brecha de Adaptacin publicado este jueves y titulado Contra viento y marea El cambio climtico ya est devastando comunidades en todo el mundo especialmente a las ms pobres y vulnerables Las furiosas tormentas estn arrasando hogares los incendios forestales estn acabando con los bosques y la degradacin del suelo y la sequa est degradando los paisajes afirm la directora ejecutiva del PNUMA Inger Andersen Andersen llam a la accin pues las personas sus medios de vida y la naturaleza de la que dependen estn en peligro real por las consecuencias del cambio climtico La agencia de la ONU urgi a mejorar la adaptacin al cambio climtico a lo largo de esta dcada tanto desde el sector pblico como desde el privado debido a los crecientes impactos que se intensifican y golpean con mayor dureza a los ms vulnerables del mundo Pero tambin alert de la enorme brecha entre las necesidades financieras para llevar a cabo esta adaptacin y la realidad de la financiacin pblica internacional Este dficit de financiacin es tan grande que incluso alcanzando el objetivo del Pacto Climtico de Glasgow de  de duplicarla hasta al menos  millones de dlares unos  millones de euros para  solo se reducira esta brecha en un   de lo necesario que se estima entre  y  millones de dlares anuales entre  y  millones de euros Como dato positivo el PNUMA subray un gran aumento interanual en la financiacin pblica internacional para la adaptacin de los pases en desarrollo de los  millones de dlares unos  millones de euros de  se pas a  millones unos  millones de euros en  Una adaptacin adecuada que incorpore la justicia y la equidad es ms urgente que nunca incidi el PNUMA pues los pases en desarrollo experimentan prdidas y daos cada vez mayores y ya luchan con cargas de deuda muy cuantiosas Mientras que el aumento de la temperatura media mundial se acerca a  C por encima de los niveles preindustriales las ltimas estimaciones del PNUMA apuntan a un aumento catastrfico de entre  y  C este siglo si no se reducen de inmediato y de forma importante las emisiones de gases de efecto invernadero En general las medidas de adaptacin siguen una tendencia al alza pero no son proporcionales al reto segn la agencia de la ONU Adems de la financiacin aadi se necesitan mayores esfuerzos en creacin de capacidades y transferencia de tecnologa Aproximadamente la mitad de los proyectos ejecutados con el apoyo de las entidades de la Convencin Marco de las Naciones Unidas sobre el Cambio Climtico NMNUCC no son satisfactorios o tienen pocas probabilidades de ser sostenibles sin los fondos del proyecto a largo plazo subray el PNUMA Respecto a la adaptacin por pases  Estados cuentan ya con al menos una estrategia mientras que  carecen de l de los cuales diez no muestran ningn indicio de estar elaborando uno,7 de noviembre de 2024,15
Trump convers con Putin tras su victoria en las elecciones y le pidi que no intensifique la ofensiva en Ucrania,Apenas dos das despus de hacerse con la victoria electoral en las presidenciales de Estados Unidos Donald Trump convers por telfono con el presidente ruso Vladmir Putin As lo ha adelantado este domingo el diario The Washington Post que cita a fuentes del entorno del republicano Trump pidi a Putin el pasado jueves que no intensifique la ofensiva militar sobre Ucrania uno de los asuntos que pueden marcar su agenda internacional a partir de enero Se trata de la primera conversacin entre ambos desde las elecciones y Trump telefone al lder ruso desde su resort en Florida Las fuentes del Post que estaban presentes en la llamada aseguran que el lder republicano mostr su inters en mantener nuevas conversaciones para tratar el final de la guerra en Ucrania Trump record adems a Putin siempre segn el relato del diario estadounidense la presencia militar de Estados Unidos en Europa y le pidi que no intensifique sus esfuerzos blicos sobre Ucrania El final de este conflicto es una de las promesas electorales de Trump que sin embargo nunca desvel cmo conseguira hacerlo La pasada semana el presidente ucraniano Volodmir Zelensky fue uno de los primeros lderes en felicitarle por su victoria El Kremlin ha negado este lunes que el presidente ruso y Donald Trump hayan mantenido una conversacin telefnica tras la victoria de Trump en las elecciones Esa noticia es una pura invencin Es una informacin falsa ha dicho Dmitri Peskov portavoz presidencial en su rueda de prensa telefnica diaria Valoro el compromiso del presidente Trump con la estrategia por la paz a travs de la fuerza en los asuntos internacionales afirm Zelensky en un comunicado Ese es precisamente el principio que puede acercarnos a una paz justa en Ucrania Tengo la esperanza de que podamos conseguirlo juntos Sin embargo el temor en Europa y entre los aliados de la OTAN es que Trump est dispuesto a defender un acuerdo de paz que requiera a Ucrania la cesin de parte de su territorio a Rusia una postura que han rechazado tambin la UE y EEUU hasta ahora Esta semana el Kremlin declar que la disposicin de Putin al dilogo con Trump no supona un cambio en los objetivos de la operacin militar especial de Rusia en territorio ucraniano El presidente Putin nunca ha dicho que los objetivos de la operacin militar especial cambien afirm el portavoz de la Presidencia rusa Dmitri Peskov en rueda de prensa Por el contrario ha repetido repetidamente que siguen siendo los mismos aadi Putin tambin felicit al republicano por su victoria electoral y declar su disposicin a mantener pronto contactos con el futuro presidente estadounidense con el que celebr una cumbre en Helsinki a mediados de  Solo respondemos ante socios y socias ante personas como t que creen que nuestro trabajo importa Por eso si nos lees habitualmente y crees en el periodismo con valores pedimos tu colaboracin para que podamos seguir siendo independientes  Te llevar menos de un minuto y puedes hacerlo desde aqu con cuotas que van desde   al mesAunque parezca una cantidad pequea sumada a las de muchas ms personas es lo que hace posible que existamosMuchas personas con pequeas decisiones pueden hacer grandes cosasHaz posible el periodismo independiente Trump asegura que ha hablado con cerca de  lderes internacionales desde el pasado martes cuando logr la victoria en las elecciones que le convertirn en el  presidente de EEUU Entre esos lderes est precisamente Zelenski y en aquella llamada tambin estuvo presente el empresario Elon Musk uno de sus mximos apoyos durante la campaa electoral El presidente de Ucrania declar posteriormente que la fortaleza de EEUU es vital para el mundo y para alcanzar la paz en su pas Segn avanza el Post este tipo de conversaciones suelen ocurrir una vez que el vencedor de las elecciones ha comenzado oficialmente el perodo de transicin con su predecesor Sin embargo Trump todava no se ha reunido con Biden ni ha sellado los acuerdos que rigen este proceso por lo que las llamadas no cuentan con el seguimiento del Departamento de Estado ni con el trabajo de traductores e intrpretes del gobierno estadounidense,10 de noviembre de 2024,10
Morales y sus seguidores defienden su candidatura para elecciones de  frente a fallo,La Paz  nov EFE El expresidente de Bolivia Evo Morales  y los sectores oficialistas que le son leales defendieron este domingo la candidatura del otrora mandatario para las elecciones de  frente a un reciente fallo constitucional que confirm que solo puede haber una reeleccin continua o discontinua El tema fue parte de la agenda abordada por ms de cinco horas en una reunin liderada por Morales en la zona central del Trpico de Cochabamba el bastin sindical y poltico del exgobernante Al presentar las conclusiones Morales sostuvo que en el encuentro se ha demostrado que Evo est habilitado para las elecciones de  y destac que quienes intervinieron en la reunin ratificaron nuevamente que l es el nico candidato del oficialista Movimiento al Socialismo MAS El viernes se conoci una sentencia firmada por los magistrados del Tribunal Constitucional Plurinacional TCP Ren Espada y Gonzalo Hurtado que establece que las autoridades electas en los poderes Legislativo Ejecutivo y Judicial tienen el ejercicio de su periodo de mandato nicamente por dos periodos sean estos continuos o discontinuos sin posibilidad de ampliarse a un tercer mandato El fallo es una aclaracin a otra sentencia emitida por el mismo Constitucional en diciembre de  que estableci que en Bolivia el presidente y vicepresidente solo pueden ser elegidos y ejercer su mandato por dos periodos ya sean continuos o discontinuos y que la reeleccin indefinida no existe y no es un derecho humano Esto afecta las intenciones de Morales de ser candidato a la Presidencia nuevamente pues ya gobern Bolivia en tres ocasiones de forma continua El lder oficialista sostuvo que la nueva sentencia fue emitida por magistrados autoprorrogados cuyos actos son nulos de pleno derecho lo que suma otro argumento jurdico que ratifica su habilitacin como candidato Morales y tambin la oposicin han cuestionado varias veces las actuaciones de los magistrados del TCP porque su mandato termin a principios de  pero en diciembre pasado decidieron extender su gestin y la de los jueces de las otras mximas cortes del pas a falta de la realizacin de las elecciones judiciales que deban efectuarse en  Segn Morales en la reunin tambin se decidi exigir la renuncia de los autoprorrogados y que se respete un congreso del MAS realizado en el Trpico de Cochabamba el ao pasado en el que fue ratificado como presidente del partido y se le nombr candidato nico para las elecciones de  El rgano electoral no reconoce ese congreso porque incumpli con un requisito del mismo estatuto del MAS que indica que estas reuniones deben convocarse en consenso entre la direccin nacional y las organizaciones que integran el partido lo que no ocurri por la pelea interna en el oficialismo entre los seguidores de Morales y los del presidente Luis Arce Arce y Morales estn distanciados desde finales de  por diferencias en la administracin del Estado la necesidad de renovar la direccin del MAS y la definicin de la candidatura oficialista para  Los sindicalistas y parlamentarios evistas o afines a Morales que intervinieron en la reunin lanzaron duras crticas contra Arce y tambin exigieron soluciones a los problemas econmicos como la falta de dlares y combustibles y el encarecimiento de alimentos Adems demandaron la liberacin de los detenidos durante las operaciones policiales y militares contra los bloqueos de carreteras que realizaron durante  das en defensa de Morales por una investigacin en su contra en un caso de trata de personas y estupro que consideran que es una persecucin poltica para evitar su candidatura En un mensaje en X Morales seal que tambin decidieron marchar hacia La Paz y Sucre la capital constitucional de Bolivia y sede del rgano Judicial aunque no precis cundo,11 de noviembre de 2024,14
Resultados de las elecciones en EEUU  quin ha ganado las elecciones en cada estado,Consulta en directo los mapas y grficos de elDiarioes para conocer los resultados de las elecciones presidenciales en los Estados Unidos Descubre si es Kamala Harris del partido Demcrata o Donald Trump del partido Republicano el candidato que gana el Colegio Electoral en cada estado Con los primeros resultados que van llegando cada estado se muestra del color del partido que est liderando el recuento pero no es hasta que se declara el candidato ganador en cada estado que ese recuento se considera ya decidido Para conocer los resultados de ambos candidatos en cada estado la siguiente tabla muestra el reparto del porcentaje de voto entre la demcrata y el republicano y la diferencia en puntos porcentuales que se dibuja entre ellos El Colegio Electoral est formado por  compromisarios Para ganar uno de los candidatos tiene que recibir al menos  votos Los compromisarios se reparten por estados y el partido ganador en cada territorio se lleva la totalidad del nmero de compromisarios asignado a ese estado excepto en Maine  y Nebraska  donde el sistema es proporcional Salvo estas dos excepciones no hay diferencia de si ganas un estado por una papeleta o por un milln si ganas te llevas todos los votos electorales de ese estado y el perdedor en ese estado no se lleva nada Solo respondemos ante socios y socias ante personas como t que creen que nuestro trabajo importa Por eso si nos lees habitualmente y crees en el periodismo con valores pedimos tu colaboracin para que podamos seguir siendo independientes  Te llevar menos de un minuto y puedes hacerlo desde aqu con cuotas que van desde   al mesAunque parezca una cantidad pequea sumada a las de muchas ms personas es lo que hace posible que existamosMuchas personas con pequeas decisiones pueden hacer grandes cosasHaz posible el periodismo independiente Una serie de estados registran los resultados ms ajustados Para seguir el recuento la siguiente tabla muestra la diferencia entre los candidatos en nmero de votos y en porcentaje de voto Tambin se puede ver la evolucin del partido del candidato ganador en las elecciones presidenciales desde  Por ltimo se puede ver cmo han cambiado los resultados en los estados ms igualados desde  Cada flecha va desde los puntos porcentuales de diferencia entre los candidatos en  hasta la misma diferencia en ,5 de noviembre de 2024,7
