title,body,date,n_paragraphs
Debate de las elecciones a Rectorado de la UPVEHU slo en castellano y sin televisin a peticin de la actual rectora,Las elecciones a Rectorado de la Universidad del Pas Vasco UPVEHU tendrn lugar el prximo  de noviembre Este viernes ha comenzado la campaa electoral que finalizar el  de noviembre y en la que se enfrentarn la actual rectora Eva Ferreira licenciada en Matemticas por la Universidad del Pas Vasco UPVEHU con un Mster en Probabilidad y Estadstica por la Universidad de Nueva York NYU y doctora en Economa y el candidato Joxerramon Bengoetxea doctor en Derecho por la Universidad de Edimburgo Catedrtico de Filosofa del Derecho por la UPVEHU y Doctor Honoris Causa por la Universidad de Helsinki Ambas candidaturas han presentado sus programas electorales El de Ferreira es un programa con  ejes y  medidas de cara a los prximos seis aos entre las que se incluye reducir el precio de la matrcula del primer ao aumentar el nmero de las becas de estudio y dignificar el salario de los profesores a tiempo parcial con el objetivo de hacer frente a la situacin que profesores y alumnos han venido denunciando a travs de diferentes protestas huelgas y con la creacin de la EHUko Prekarioen Koordinadora Coordinadora de precarios de la UPV Por su parte Bengoetxea ha presentado una cadidatura a la Rectora que busca impulsar una gobernanza horizontal que ample el sentimiento de pertenencia y el cuidado de la comunidad universitaria Dentro de sus propuestas destaca un Plan de Digitalizacin Integral para modernizar la imagen de la universidad unificar plataformas y reducir la burocratizacin as como la creacin de un gora Digital para la participacin universitaria y fomentar la transparencia en la gestin y la participacin financiado por programas externos a las partidas universitarias Adems el candidato se compromete a mejorar las condiciones laborales por un lado analizando reestructurando y aumentado el personal de administracin y servicios y dotando a los grupos de investigacin consolidados de una persona de administracin Ambas candidaturas se medirn en dos debates que por exigencia de la actual rectora Eva Ferreira no se realizarn en la televisin pblica vasca ni en euskera As lo ha denunciado el candidato Joxerramon Bengoetxea La otra candidata Eva Ferreira ha rechazado participar en los debates televisivos propuestos por el ente pblico de comunicacin vasco EiTB ha criticado en una rueda de prensa Segn Bengoetxea EiTB lleva trabajando desde septiembre para los debates y Ferreira ha estado sin dar respuesta hasta esta semana Finalmente ha dado su negativa a participar en debates televisivos algo que el otro candidato lo califica de incomprensible ya que la televisin pblica es el medio ideal para organizar un debate con toda imparcialidad trasladar propuestas a la comunidad universitaria y acercar la UPVEHU a la sociedad vasca Desde la candidatura de Ferreira explican a este peridico que participarn en dos debates el prximo  de noviembre un debate organizado por el Consejo de Estudiantes que contar con pblico ser emitido en directo por la televisin de la UPVEHU y el prximo  de noviembre un debate realizado por Radio Euskadi la radio pblica vasca Este peridico trat de realizar un debate propio con los dos candidatos pero desde la candidatura de la actual rectora no aceptaron la invitacin alegando que han decidido priorizar la primera peticin de debate que les lleg y que fue por parte del Consejo de Estudiantes A pesar de ello Bengoetxea ha denunciado que han puesto dificultades al Consejo de Estudiantes tardando en darles una respuesta sobre el debate alegando que Ferreira tena la agenda llena y exigindoles en un primer momento que el debate se realizara sin pblico y se emitiera por streaming Otra de las cuestiones que han criticado desde la candidatura de Bengoetxea es que ambos debates sean solo en castellano En la Universidad del Pas Vasco tenemos dos lenguas oficiales y nuestra comunidad merece tambin un debate en euskera han lamentando El rector o la rectora es la mxima autoridad acadmica la elige la comunidad universitaria mediante eleccin directa y sufragio universal libre secreto y ponderado Se elige entre el personal docente e investigador permanente doctor a tiempo completo que como mnimo est en posesin de tres sexenios de investigacin tres quinquenios docentes y cuatro aos de experiencia de gestin universitaria en algn cargo unipersonal El sistema de voto en las elecciones rectorales es ponderado cada colectivo universitario mantiene un porcentaje de voto por lo que los apoyos recibidos por cada candidatura se expresan en porcentaje Los porcentajes son los siguientes el profesorado doctor con vinculacin permanente cuenta con un  el profesorado no doctor con vinculacin permanente y personal docente e investigador doctor sin vinculacin permanente un  el resto del personal docente e investigador un  el alumnado un  y por ltimo el personal Tcnico de Gestin y de Administracin y Servicios un  La participacin del alumnado en las elecciones a Rectorado suele ser escasa En  con Iaki Goirizelaia como nico candidato solo votaron  de  estudiantes  En  con Nekane Balluerka la participacin fue del    de  estudiantes Mientras que en  con Eva Ferreira votaron  de  estudiantes  Teniendo en cuenta estos datos desde el Consejo de Estudiantes de la Universidad del Pas Vasco UPVEHU han hecho pblicas ms de  medidas dirigidas a los candidatos con el objetivo de construir una universidad pblica ms accesible y participativa elDiarioesEuskadi est en X en Facebook en Instagram en Telegram en WhatsApp y en Threads Cada semana te enviamos un boletn a tu correo electrnico Apntate Recuerda que puedes ser socio o socia de elDiarioes clicando aqu Y para ms informacin puedes llamar o escribirnos al    ,9 de noviembre de 2024,9
Genocidas de mierda Puerto Rico utiliza su voto sin valor en las elecciones de EEUU para apoyar a Palestina,En un acto de solidaridad y protesta muchos puertorriqueos han utilizado sus elecciones simblicas a la presidencia de EEUU para mostrar su rechazo a la guerra en Gaza A travs de papeletas en las que Puerto Rico expresa su preferencia por Kamala Harris o Donald Trump sin que su voto cuente para el resultado oficial los votantes del territorio no incorporado de EEUU han criticado la matanza israel y a Washington Estadistas o independentistas somos anticolonialistas y es en ese punto donde empatizamos con el conflicto en Gaza seala a elDiarioes Kenneth McClintock expresidente del Senado y representante del Partido Nuevo Progresista PNP A pesar de las diferencias ideolgicas muchos puertorriqueos comparten una postura comn contra la colonizacin lo que los impulsa a solidarizarse con la lucha palestina por la autodeterminacin ha sostenido el tambin ex secretario de Estado Varios partidos como el Movimiento Victoria Ciudadana MVC y el Partido Independentista Puertorriqueo PIP hicieron campaa para votar en blanco en las elecciones no vinculantes a la presidencia y sobre el estatus jurdico de la isla respecto a EEUU como forma de protesta En este contexto muchos puertorriqueos aprovecharon la oportunidad para expresar su descontento con el Gobierno escribiendo mensajes en las papeletas Segn la Comisin Estatal de Elecciones CEE hubo un mayor nmero de votos nulos que en las elecciones a gobernador las legislativas y las municipales En el caso de la papeleta de preferencia presidencial de EEUU los nulos representaron un   En el caso de la votacin no vinculante sobre la relacin jurdica de la isla con EEUU independencia estadidad o soberana en libre asociacin con los EEUU los votos nulos fueron un   La estadidad obtuvo el  de los votos seguida por la independencia con el  la primera vez que esa opcin alcanz el segundo lugar Sin embargo cualquier cambio de estatus requiere la aprobacin del Congreso de EEUU En cuanto a las presidenciales el  de los votantes mostr su preferencia por Kamala Harris Adems de las alusiones a Palestina los temas ms comunes de protesta en las papeletas fueron las crticas a la compaa privada de energa elctrica LUMA y a la Junta de Control Fiscal entidad federal de EEUU que controla las finanzas del pas desde  En la protesta tambin han participado polticos como el caso de Rafael Bernab senador por el Movimiento Victoria Ciudadana que mostr su apoyo a Palestina en una de las papeletas Histricamente Puerto Rico ha votado en elecciones sobre su estatus territorial ya sea estadidad independencia o libre asociacin pero estos resultados no son vinculantes Esta vez tambin incluy la eleccin presidencial de EEUU aunque Puerto Rico no tiene representacin directa en dichas elecciones lo que genera dudas sobre la utilidad de estos plebiscitos segn Gabriel Casal candidato a representante por el Distrito  de San Juan  Guaynabo  Aguas Buenas por el Partido Independentista Puertorriqueo y la Alianza de Pas Estas votaciones refuerzan la condicin colonial de la isla y la falta de autonoma poltica denuncia Casal A pesar de que los puertorriqueos participan repetidamente en este tipo de plebiscitos los resultados no han provocado cambios en la situacin territorial de la isla ya que el Congreso de EEUU tiene la autoridad final sobre su estatus poltico No se van a admitir estados nuevos dijo Mitch McConnell lder de los republicanos en la Cmara de Representantes un da despus de las elecciones McConnell describe esta propuesta como parte de la agenda radical y socialista del Partido Demcrata El voto del estado territorial y las elecciones presidenciales no tienen peso ni significado en Puerto Rico dice a elDiarioes el socilogo poltico Emilio Pantojas quien seala que los votos en blanco son una forma de protesta Bianca Pea funcionaria de las elecciones y voluntaria en la Red de Solidaridad con Palestina crtica los fondos pblicos invertidos en este proceso alegando que ese dinero podra haberse invertido en mejoras estructurales de escuelas usadas como centros de votacin Algunos votantes como Louann Blass y Samira Zabeth tambin usaron sus votos para expresar su solidaridad con Palestina Ambas destacan las similitudes entre la situacin colonial de Puerto Rico y Palestina Zabeth al igual que Pea recuerda los abusos histricos sufridos por Puerto Rico a manos de EEUU como el caso de la marina de Vieques EEUU utilizaba esta zona de Puerto Rico para ensayos militares y denuncia la indiferencia de la comunidad internacional hacia los pueblos colonizados En consonancia con Zabeth Bernab asegura que aunque algunos puertorriqueos no quieren ser parte de EEUU muchos ven como ofensivo el hecho de que su voto sea simblico y no tenga peso real Zabeth destaca la prdida de identidad cultural y los efectos de las polticas exteriores que sufren Palestina y Puerto Rico mencionando el sufrimiento puertorriqueo por la violencia histrica de EEUU en momentos de desastres naturales y experimentacin cientfica y militar 	Tambin subraya la retencin durante tres aos de fondos federales posterior a los huracanes Mara e Irma en  el uso de la Marina de Vieques para hacer pruebas no reguladas de armas y bombas militares hasta el  y el uso de puertorriqueos como ratas de laboratorio en el desarrollo de frmacos como la pldora anticonceptiva en los aos  Grecia Ortiz tambin aprovech esta papeleta para expresar su postura anticolonial y a favor de una Palestina libre Haciendo esos esfuerzos simblicos le estamos rogando a EEUU hace aos que nos acoja como estado Luego de aos y aos de negligencia e indiferencia hacia Puerto Rico ahora vamos a ser estado dice Ortiz decidi tachar toda la papeleta y escribir Abajo el genocidio Palestina ser libre como protesta Pudiramos ser nosotros Palestina es un territorio ocupado Puerto Rico una colonia Espero ver ambos libres en algn momento de mi vida dice Gabriel anul su papeleta y escribi Genocidas de mierda Viva Palestina Este voto simblico es una estrategia del Partido Nuevo Progresista PNP partido poltico del Gobierno actual a favor de la estadidad para mantener la ilusin de la estadidad en la isla afirma Nos quieren hacer pensar que podemos escoger burlndose de nuestro estado colonial y recordndonos su poder opina Vernica Martnez que tambin us su papeleta en protesta de la ofensiva en Gaza Solo respondemos ante socios y socias ante personas como t que creen que nuestro trabajo importa Por eso si nos lees habitualmente y crees en el periodismo con valores pedimos tu colaboracin para que podamos seguir siendo independientes  Te llevar menos de un minuto y puedes hacerlo desde aqu con cuotas que van desde   al mesAunque parezca una cantidad pequea sumada a las de muchas ms personas es lo que hace posible que existamosMuchas personas con pequeas decisiones pueden hacer grandes cosasHaz posible el periodismo independiente Los electores son libres para decidir lo que hacen con sus papeletas de votacin Pueden optar por emitir un voto que sea contabilizado para los fines para los que se convoca la eleccin o utilizarlo para otro propsito a sabiendas de que puede ser anulado Sea para apoyar cualquier causa respeto la decisin que tome cada elector de hacer con su oportunidad de votar lo que quiera incluyendo el desperdiciarla ha declarado a este medio la delegada congresional de Puerto Rico al Senado de EEUU Zoraida Bux Aunque es una decisin no vinculante el socilogo Emilio Pantojas ha destacado que en la medida en que Kamala Harris obtuvo la mayora de votos Puerto Rico se antagoniza a Donald Trump opositor de la estadidad Esto podra resultar en un elemento negativo para la nueva gobernadora y ex representante de Puerto Rico en la Cmara de Representantes de EEUU Jeniffer Gonzlez en sus relaciones con Trump durante su periodo como presidente,8 de noviembre de 2024,19
Un Scholz presionado se abre a que se convoquen elecciones ya si hay acuerdo con oposicin,Clara Palma Berln  nov EFE El canciller alemn Olaf Scholz se ha abierto este viernes bajo creciente presin a la posibilidad de someterse a la mocin de confianza en el Parlamento antes de enero para que se celebren elecciones anticipadas cuanto antes si la oposicin conservadora apoya a cambio algunas leyes pendientes Sera bueno si en el Bundestag Cmara Baja se lograra un acuerdo entre los grupos parlamentarios democrticos sobre qu leyes se pueden aprobar este ao dijo al trmino de una cumbre de lderes europeos en Budapest El canciller socialdemcrata apunt que esto tambin podra responder la pregunta sobre qu momento es el correcto para el voto de confianza No obstante Scholz remach que la decisin no es puramente poltica ya que hace falta un cierto tiempo para cumplir los requisitos que marca la Comisin Electoral y para que los partidos puedan prepararse para las campaas Elecciones lo antes posible Este viernes el jefe de la opositora Unin Democristiana CDU el conservador Friedrich Merz que lidera las encuestas y al que muchos consideran el prximo canciller rechaz cooperar con el Ejecutivo de Scholz que se ha quedado en minora tras la expulsin de los liberales para sacar adelante leyes salvo que el canciller se presente ya el prximo mircoles sin ms dilacin a un voto de confianza En declaraciones a la cadena RTL exigi posteriormente que los comicios se celebren tan pronto como el  de enero la vspera de la toma de posesin del presidente electo estadounidense Donald Trump Tambin los liberales recin llegados a la oposicin reclaman elecciones lo antes posible una opcin que segn sondeos como el de infratest dimap para la primera cadena de televisin ARD favorecen dos tercios de los alemanes un   De acuerdo con el Politbarometer de la cadena ZDF el   de los encuestados saluda el fin de la coalicin y el   quiere elecciones anticipadas en Alemania mientras que la mitad prefiere que tengan lugar antes de marzo como quiere Scholz Sin embargo segn el semanario Der Spiegel la presidenta de la Comisin Electoral ha pedido a Scholz no precipitar los comicios ya que el plazo mximo de  das entre el voto de confianza y las elecciones se vera acortado si las fiestas caen de por medio lo que es arriesgado desde el punto de vista organizativo Ayuda a Ucrania garantizada Originalmente estaba previsto que la Comisin Presupuestaria del Bundestag cerrase el prximo jueves el borrador de los presupuestos de  pero con la salida de los liberales del Gobierno y sin la ayuda de la CDU no ser posible aprobarlos ni tampoco un presupuesto suplementario para aumentar el endeudamiento de este ao en  millones de euros hasta  millones El bloqueo de los presupuestos y la consiguiente gestin provisional impedir al Gobierno de Scholz mientras dure la situacin autorizar el gasto de partidas que no sean irrenunciables o estn ya comprometidas legalmente Pese a ello una portavoz del canciller asegur este viernes en Berln que el apoyo militar y financiero a Ucrania el ao prximo tanto a nivel bilateral como en el marco del G est garantizado aunque no quiso hacer conjeturas sobre ayudas adicionales que pudieran resultar necesarias Scholz desde Budapest fue algo ms ambiguo ya que apunt a que con la lnea de crdito de  millones de euros del G est claro que en el prximo periodo hay medios disponibes para que Ucrania mantenga su capacidad de defensa al margen de restricciones fiscales de pases aislados El borrador de las cuentas para  cifra la partida destinada a Ucrania en unos  millones de euros Candidatura en el aire Un problema aadido para Scholz es que su partido todava no tiene un candidato formal a la Cancillera La cpula de su partido le ha expresado su respaldo en este sentido por el momento pero la formacin no ignora que el actual ministro de Defensa Boris Pistorius es infinitamente ms popular ya que segn sondeos actuales dos tercios de los simpatizantes socialdemcratas le querran como candidato mientras que solo un tercio apoya que Scholz repita El democristiano Merz es el nico candidato que ya ha sido nominado oficialmente en su caso de forma conjunta para la CDU y su partido hermano bvaro la Unin Socialcristiana CSU Pendientes de confirmacin por sus respectivos partidos se hallan todava la ultraderechista Alice Weidel colder de Alternativa para Alemania AfD que podra convertirse en segunda fuerza por detrs de los democristianos y el vicecanciller y ministro de Economa el verde Robert Habeck que anunci este viernes su candidatura,8 de noviembre de 2024,22
Dalmau reconoce su derrota en las elecciones de Puerto Rico y pide aceptar el resultado,San Juan  nov EFE El independentista Juan Dalmau que qued en segundo lugar en las elecciones a la Gobernacin de Puerto Rico reconoci este viernes su derrota y pidi a sus simpatizantes aceptar el resultado afirmado que los grandes cambios a veces no llegan a la velocidad esperada Este reconocimiento explcito era necesario debido a que en los ltimos das se han sucedido en redes sociales denuncias de supuesto fraude electoral y se han producido tambin algunas manifestaciones que ponan en duda la victoria de Jenniffer Gonzlez frente a Dalmau Luego de culminar el evento electoral y conceder el espacio necesario en el proceso podemos concluir que la pluralidad de votos favorecen la candidatura de Jenniffer Gonzlez para la Gobernacin de Puerto Rico seal Dalmau candidato de la Alianza de Pas en un comunicado Segn los resultados parciales de la Comisin Estatal de Elecciones CEE Gonzlez logr en los comicios del pasado martes el   de los votos y Dalmau el   Dalmau dese a Gonzlez del Partido Nuevo Progresista PNP que cumpla cabalmente su deber de tratar con justicia respeto y sensibilidad a todos los puertorriqueos y puertorriqueas sin importar afiliaciones partidistas Igualmente ha quedado claro que una mayora de los electores puertorriqueos votaron de un modo u otro por un cambio Hemos escrito una nueva pgina en nuestra historia y somos la fuerza de mayor empuje y crecimiento del pas subray el lder del Partido Independentista Puertorriqueo PIP Avanzamos ms de lo que muchos esperaban Los grandes cambios sin embargo a veces no llegan a la velocidad que quisiramos Comprendo cmo te sientes y que el resultado no haya sido lo que hubisemos querido Pero te aseguro que la lucha ha valido la pena y tu voto no fue en vano agreg Aunque no gan las elecciones Dalmau hizo historia al quedar en segundo lugar en la contienda por el cargo de gobernador que desde hace dcadas han ocupado el PNP y el Partido Popular Democrtico PPD El PNP se hizo en las elecciones adems con el control de la Legislatura mientras que el PPD pese a su debacle en la Gobernacin logr una mayora de alcaldas y el puesto de comisionado residente en Washington,8 de noviembre de 2024,9
ONG venezolana exige la liberacin de los presos polticos detenidos tras las elecciones,Caracas  nov EFE La ONG de Venezuela Observatorio de Derechos Humanos de la Universidad de Los Andes ODHULA exigi este viernes la liberacin de todos los presos polticos detenidos tras las presidenciales del pasado  de julio cuando se desataron protestas contra el resultado oficial que dio una cuestionada reeleccin a Nicols Maduro A travs de X el observatorio expres su profunda preocupacin por el incremento de la represin estatal y la persecucin poltica contra universitarios entre los que cont  detenidos de forma arbitraria tras las elecciones de los cuales  ya fueron liberados segn ha identificado Asimismo detall que ms de  universitarios permanecen encarcelados acusados de terrorismo incitacin al odio traicin a la patria conspiracin y resistencia a la autoridad Por otra parte resalt que el pasado  de septiembre las universidades reiniciaron sus actividades pero afirm decenas de universitarios no han podido reincorporarse por ser vctimas de persecucin poltica El ODHULA asegur que el  de septiembre fueron expulsados  estudiantes de la Universidad Nacional Experimental de la Seguridad en Caracas por protestar el da de las elecciones del  de julio y denunciar el voto asistido por parte del director en favor de Nicols Maduro Tras las presidenciales fueron detenidas durante las protestas ms de  personas en su mayora sealadas por la Fiscala de cometer violencia y vandalismo mientras la mayor coalicin opositora Plataforma Unitaria Democrtica acusa de represin a los agentes de seguridad del Estado para impedir las manifestaciones,8 de noviembre de 2024,6
El control del Congreso de EEUU sigue en el aire tres das despus de las elecciones,Washington  nov EFE Republicanos y demcratas en Estados Unidos siguen pendientes este viernes tres das despus de las elecciones legislativas del recuento de unos  escaos de la Cmara de Representantes que definirn el control del Congreso los prximos dos aos Ninguno de los dos partidos se ha asegurado todava la mayora de  escaos en la Cmara Baja Los conservadores llevan  por  los demcratas con  an por definir de acuerdo al recuento de la agencia Associated Press AP De estos  asientos por definir  pertenecen a California Estos escaos de la Cmara Baja no son la nica duda que dejan las elecciones del martes Aunque el republicano Donald Trump fue el ganador de las presidenciales an no se sabe qu candidato qued primero en los estados de Nevada y Arizona Trump lleva  votos electorales ms de los  necesarios para ganar por  de la demcrata Kamala Harris En el Senado arrebatado por los republicanos a los demcratas la misma noche electoral tambin faltan por definirse los escaos de Nevada y Arizona este ltimo con el recuento apenas en el   tras tres jornadas de escrutinio A falta de esos dos escaos los republicanos lideran el recuento  tras arrebatar cuatro asientos a los demcratas retomando el control de la Cmara Alta tras cuatro aos en la oposicin Incertidumbre electoral Los recuentos lentos y la incertidumbre han sido una tnica en las ltimas citas electorales en Estados Unidos En las elecciones presidenciales de  hubo que esperar  das para conocer al ganador En las legislativas de  el control de la Cmara de Representantes no se defini hasta  das despus de los comicios Esto se debe a que algunos estados cada uno con su propio sistema electoral tienen complejos sistemas de escrutinio En Arizona y California de los ms lentos del pas gran parte del electorado vota por correo anticipadamente una modalidad fomentada por las autoridades para favorecer la participacin Procesar esos votos toma ms tiempo porque implica verificar uno a uno que la firma del votante en el sobre coincida con la del registro de electores California adems sigue aceptando votos por correo hasta siete das despus de los comicios siempre que hayan sido enviados antes de la fecha lmite de la eleccin Si las elecciones estn especialmente ajustadas entran en juego los conocidos como votos provisionales esos emitidos por un elector sobre el que existen dudas sobre su derecho a votar porque por ejemplo no figura en el registro Esos votos tambin son revisados uno a uno para definir cules se terminan validando,8 de noviembre de 2024,16
