title,body,date,n_paragraphs
Innovaciones tecnolgicas contra el cambio climtico y la prdida de biodiversidad,Amaia Echevarria Bruselas  nov EFE El poder de las tecnologas como los drones los sensores las cmaras las redes de baja potencia y la tecnologa satelital se emplean cada vez ms para monitorizar de forma remota el comportamiento de la vida salvaje y los cambios en el hbitat en tiempo real desarrollando as soluciones innovadoras para abordar las causas de la prdida de biodiversidad Los recientes avances en los sensores de observacin de la Tierra por satlite tambin estn proporcionando una mejor cobertura global resolucin y precisin y una gama ms amplia de mediciones observables Esta tecnologa cobra particular importancia en el caso de los desastres naturales como el de la dana que ha afectado a Espaa especialmente a Valencia Mediante imgenes en tiempo real y datos de alta precisin el sistema Coprnico gestionado por la Comisin Europea permite a las autoridades monitorizar zonas afectadas por desastres naturales y coordinar los equipos de emergencia para responder de la forma ms rpida y eficaz posible Proyectos de innovacin con impacto local Noruega cuenta con  fiordos y posee la segunda lnea costera ms larga del mundo adems de mltiples ros y lagos Su extenso sistema fluvial tambin alberga la zona de reproduccin ms grande del mundo para el salmn atlntico salvaje Sin embargo la poblacin de salmn salvaje del Atlntico noruego ha disminuido un  desde la dcada de  principalmente debido a la presencia del salmn jorobado que fue introducido artificialmente en la dcada de  para aumentar el suministro de alimentos Los mtodos tradicionales para proteger las poblaciones de esta especie requieren de voluntarios que se sumerjan en el ro para intentar identificar a los salmones jorobados por sus jorobas machos o las manchas de sus colas hembras y retirarlos con las manos lo que hace imposible monitorear y cuantificar con precisin la amenaza En  la asociacin local de caza y pesca Berlevag JFF BJFF se puso en contacto con la tecnolgica china Huawei para estudiar una posible solucin tecnolgica que permitiese identificar los tipos de peces y filtrar las especies invasoras dando como resultado el primer sistema inteligente de filtrado de salmn basado en IA del mundo Asociacin entre el sector privado y la comunidad local Proyectos como el de Noruega adems representan los esfuerzos combinados de la comunidad local los grupos de conservacin y las empresas de tecnologa Lo mismo ocurre con el resto de iniciativas que forman parte del programa TECHALL lanzado en  y alineado con los Objetivos de Desarrollo Sostenible de la ONU que aprovecha la tecnologa y las alianzas para crear un impacto positivo en cuatro mbitos medio ambiente educacin salud y desarrollo En el mbito medioambiental TECHALL ha ejecutado proyectos de conservacin de la naturaleza en  reas protegidas con socios globales y locales en ecosistemas forestales de humedales y ocenicos de todo el mundo En los ltimos cinco aos el programa TECHALL de Huawei ha demostrado cmo la tecnologa puede ser una poderosa fuerza para el bien abordando desafos globales en proteccin ambiental educacin e inclusin digital afirm Harvey Zhang consejero delegado de Huawei Austria durante la celebracin del quinto aniversario de la iniciativa en Viena En el evento Tony Jin vicepresidente ejecutivo de Huawei Europa destac la importancia de sus esfuerzos ambientales en Austria donde se lleva a cabo uno de los proyectos de conservacin emblemticos de la empresa para conservar el cinturn de juncales ms extenso de Europa en el lago lago Neusiedl cuyos  kilmetros cuadrados se reparten entre Austria y Hungra Un problema que tambin necesita soluciones globales La agrupacin internacional de organizaciones a favor de los derechos civiles European Digital Rights EDRI defiende que la Inteligencia Artificial y otras tecnologas ofrecen ventajas pero no constituyen la solucin para un problema global seal en declaraciones a EFE Blue Tiyavoraun asesora poltica de la organizacin Sabemos que hay algunas tecnologas o algunos proyectos que se hacen que permiten detectar especies o tener algn anlisis de datos que lo haran ms eficiente o ayudara de alguna manera admiti pero en su opinin son pequeas soluciones a un gran problema que no puede ser resuelto completamente por estas tecnologas,11 de noviembre de 2024,19
Qu implica el Acuerdo de Pars contra el cambio climtico que se revisa en la COP de Bak,El ao  se alcanz en la capital de Francia el Acuerdo de Pars contra el cambio climtico Este lunes los pases se renen en Azerbaiyn para seguir desarrollndo esta herramienta global que trata de aplacar la crisis del clima y sus impactos El acuerdo es un tratado internacional jurdicamente vinculante por el que los pases firmantes se comprometen a hacer los esfuerzos necesarios para impedir que la temperatura global del planeta al final del siglo XXI suba ms de C respecto a la que era antes de la era industrial y preferiblemente que ese lmite sea C Para esa era preindustrial se toma como referencia aproximada el ao  Se trata como explica el texto de un objetivo a largo plazo Porque reducir las emisiones de gases de efecto invernadero implica un cambio gigantesco del modelo de produccin y consumo en el planeta hasta ahora basado en la quema de combustibles fsiles que provocan esas emisiones La aplicacin del acuerdo requiere una transformacin econmica y social basada en la mejor ciencia disponible describe la propia ONU Tambin porque la inercia climtica se mide en dcadas la vida activa de gases como el CO en la atmsfera es tan larga que aunque ahora mismo se cortaran las emisiones completamente su efecto se prolongar muchos aos como ha explicado recientemente la Organizacin Meteorolgica Mundial en su anlisis sobre cunto CO hay actualmente acumulado en la atmsfera Lo ms novedoso de este acuerdo es que los pases que se adhieren se comprometen a hacer todo lo que est en su mano para conseguir ese objetivo y se admite que el origen de ese calentamiento global que provoca el cambio climtico son las emisiones de gases de efecto invernadero causadas por los seres humanos Tambin se comprometen a conseguir que las emisiones de gases a nivel mundial alcancen cuanto antes un mximo para poder desde entonces comenzar a bajar El acuerdo reconoce que los pases empobrecidos tendrn ms tiempo para llegar a su punto mximo La idea es que a partir de  la cantidad de gases que sigan bombendose a la atmsfera y la cantidad que se absorba en los bosques los suelos y los ocanos sea equivalente una especie de resta a cero para llegar a lo que denomina neutralidad climtica Ese compromiso segn exige el acuerdo tiene que plasmarse en Planes Nacionales Climticos de cada pas NDC en los que han de detallarse bsicamente cunto van a recortar sus emisiones y cmo Esos planes se renuevan cada cinco aos La prxima ronda de planes NDC debe hacerse en  y tienen que ser ms ambiciosos que los anteriores como establece el tratado El acuerdo incluye que los pases ricos van a ayudar econmicamente a los pases en desarrollo para cumplir el acuerdo Que van a poner dinero para recortar sus emisiones proteger bosques que absorben CO o implantar energas limpias Este modelo de tratado ha hecho que  de los  pases que integran la Convencin Marco de las Naciones Unidas para el Cambio Climtico hayan ratificado este acuerdo que entr en vigor un ao despus de alcanzarse en  El Protocolo de Kioto por ejemplo se acord en  y no entr en vigor hasta  Estados Unidos no lo ratific y Canad lo abondon Solo respondemos ante socios y socias ante personas como t que creen que nuestro trabajo importa Por eso si nos lees habitualmente y crees en el periodismo con valores pedimos tu colaboracin para que podamos seguir siendo independientes  Te llevar menos de un minuto y puedes hacerlo desde aqu con cuotas que van desde   al mesAunque parezca una cantidad pequea sumada a las de muchas ms personas es lo que hace posible que existamosMuchas personas con pequeas decisiones pueden hacer grandes cosasHaz posible el periodismo independiente La marcha y progreso del acuerdo se revisa cada ao en la Conferencia de la Partes de la Convencin Conference of the Parties en ingls o COP Este ao se celebra en Bak Azerbaiyn en lo que se conoce como COP Cada COP tambin esta tiene una agenda para desarrollar y acordar las tareas que implica aplicar el acuerdo Por ejemplo este ao en teora toca revisar la cantidad de dinero que los pases ricos han de poner cada ao para asistir a los pases en desarrollo El ao que viene la COP debera tener encima de la mesa los nuevos planes nacionales climticos,11 de noviembre de 2024,12
El   de espaoles apoya medidas para adaptarse al cambio climtico segn sondeo del BEI,Bruselas  nov EFEEl   de los espaoles apoya la adopcin de medidas para hacer frente a los efectos del cambio climtico y la mayora de ellos   cree que invertir ahora en adaptacin tambin evitar mayores costes en el futuro segn una encuesta publicada este lunes por el Banco Europeo de Inversiones BEI La mayora de espaoles preguntados en agosto de  por el BEI consideran que el cambio climtico es uno de los mayores retos a los que se enfrenta el pas segn la encuesta anual sobre el clima encargada por la institucin que preside Nadia Calvio La publicacin forma parte de las actividades anuales del BEI para la Conferencia de las Partes en la Convencin Marco de las Naciones Unidas sobre el Cambio Climtico COP que este ao se celebrar en Bak Azerbaiyn desde hoy hasta el  de noviembre La encuesta se realiz antes de las recientes inundaciones en Espaa An antes de la catstrofe registrada especialmente en Valencia el   de los encuestados espaoles muy cerca de la media de la UE que se sita en el   afirm que es importante que Espaa se adapte al cambio climtico incluso dos tercios de ellos el    puntos por encima de la media de la UE del   declararon que es una prioridad El   frente a la media de la UE del   estaba de acuerdo antes de las inundaciones de finales de octubre en que es necesario un gasto inmediato en adaptacin al cambio climtico para evitar costes an mayores en el futuro Como han demostrado las trgicas inundaciones en Espaa el impacto del cambio climtico a travs de fenmenos meteorolgicos extremos es una terrible realidad Resulta apremiante invertir en resiliencia y adaptacin as como en mitigacin de los efectos del cambio climtico declar Calvio en un comunicado La presidenta del BEI incidi en que una transicin ordenada es tambin la opcin ms rentable desde el punto de vista econmico Cada euro invertido en prevencin y resiliencia ahorra entre cinco y siete euros de gasto en reparar los daos asegur A medida que las catstrofes naturales aumentan en frecuencia y gravedad el coste econmico del cambio climtico sigue creciendo drsticamente record el BEI en el comunicado Segn un informe de la Agencia Europea de Medio Ambiente Europa es actualmente el continente que est experimentando un proceso de calentamiento ms rpido y se prev que los fenmenos meteorolgicos extremos aumenten conforme suba la temperatura global Este mayor nmero de fenmenos meteorolgicos extremos plantea una amenaza significativa para las infraestructuras y la estabilidad del abastecimiento mundial de agua y alimentos lo que subraya la urgente necesidad de estrategias globales de adaptacin al cambio climtico subray el BEI De hecho los espaoles encuestados en agosto pasado afirmaron que su experiencia personal con fenmenos meteorolgicos extremos acrecienta su sensacin de urgencia por actuar As el    puntos por encima de la media de la UE dijo haber sufrido al menos un fenmeno meteorolgico extremo olas de calor sequas incendios forestales o inundaciones en los ltimos cinco aos y el   de los espaoles frente al   de la UE piensa que tendr que adaptar su estilo de vida a causa del cambio climtico Un sentimiento que lleva al   frente a la media de la UE del   de considerar que en el futuro tendr que cambiar su lugar de residencia para evitar fenmenos extremos Son los datos ms relevantes de la sptima encuesta anual sobre el clima del BEI en la que se recogen las opiniones de ms de  encuestados de toda la Unin Europea y Estados Unidos acerca del cambio climtico En Espaa participaron  personas,11 de noviembre de 2024,16
Greenpeace despliega pancarta gigante en Madrid Frenar el cambio climtico salva vidas,Madrid  nov EFE Greenpeace ha desplegado este lunes una enorme pancarta en la Plaza de Espaa de Madrid con el mensaje Frenar el cambio climtico salva vidas junto a un crespn negro en solidaridad con las vctimas de la dana que ha sacudido especialmente a Valencia Coincidiendo con el inicio de la cumbre climtica COP en Azerbaiyn la organizacin pide a los lderes mundiales que acuerden nuevos impuestos verdes a las petroleras y gasistas por los daos que producen Greenpeace pide al Gobierno espaol que ample el actual gravamen temporal a las grandes energticas y los bancos tras la guerra de Ucrania y la covid para disponer de recursos para atender a las poblaciones devastadas por la dana La crisis climtica que cursa en forma de eventos meteorolgicos extremos ms frecuentes e intensos ya es una realidad y los combustibles fsiles son la principal causa advierte la organizacin en una nota de prensa La organizacin considera que el actual contexto de unidad social frente al desastre es tambin momento de exigir la contribucin de las grandes corporaciones con crecientes beneficios implementando el principio de quien contamina paga Por otra parte la prevencin y la adaptacin a los eventos meteorolgicos cada vez ms extremos son urgentes e imprescindibles para proteger a la poblacin y la nica accin climtica realmente efectiva es el abandono progresivo pero definitivo de los combustibles fsiles Hay que erradicar el carbn el petrleo y el gas para siempre sustituyndolos por energas renovables eficientes adems de abandonar consumos energticos superfluos yo excesivos segn Greenpeace El cambio climtico nos ha sacudido con extrema dureza en Valencia si no se acta con firmeza lo volver a hacer Esta dana tiene que marcar un antes y un despus el punto de inflexin en la comprensin de la emergencia climtica que la ciencia lleva advirtiendo desde hace aos,11 de noviembre de 2024,9
La Econmica trae a La Palma a Luis Ortigosa para hablar de enfermedades emergentes y cambio climtico,El prximo da  de noviembre a las  horas la Sociedad Econmica de Amigos de El Pas de La Palma ha programado una conferencia en el Aula del Espacio Cultural de CajaCanarias de Santa Cruz de La Palma en la que intervendr Luis Ortigosa Castillo reconocido mdico especialista en Pediatra diplomado en Sanidad por la Escuela Nacional de Sanidad profesor asociado de Pediatra de la Facultad de Medicina de la Universidad de La Laguna  acadmico de la Real Academia de Medicina de Canarias experto universitario en vacunas por la Universidad Complutense de Madrid y miembro del Grupo Tcnico de Vacunas Comit Asesor del Gobierno de Canarias para hablar sobre Enfermedades emergentes y cambio climtico Prxima pandemia Sin prensa independiente no podrn resistir los derechos y libertades democrticas y por eso Canarias Ahora se ha convertido en un medio muy incmodo que algunos querran acallarSomos uno de los pocos peridicos de referencia que sigue siendo libre en las Islas y no se vende a los caciques ni participa de las redes clientelaresT que nos lees habitualmente lo sabes bien Te imaginas cmo sera el periodismo en Canarias si Canarias Ahora no existiera Cmo sera el debate pblico sin nuestra voz Te imaginas qu Archipilago nos quedara Te llevar menos de un minuto y puedes hacerlo desde aqu con cuotas que van desde   al mes El tema elegido para esta ocasin nos coloca ante una problemtica que cobra especial importancia dadas las alarmas existentes en la actualidad por la aparicin de patgenos y trasmisores de enfermedades an poco conocidas y su rpida difusin as como por las diferentes informaciones relativas a la aparicin de riesgos para la salud humana y animal como consecuencia no solo de los procesos de cambio climtico y de calentamiento global sino tambin de la generalizacin de movimientos transfronterizos la capacidad de respuesta de los actuales equipamientos y los sistemas sanitarios en los diferentes pases que ya fueron puestos en situacin lmite en la pasada pandemia del Covid los nuevos tipos de vacunas y los movimientos que se oponen a ellas o la creciente resistencia a los antibiticos por uso indebido de los mismos explica La Econmica apuesta por la difusin del conocimiento y la prevencin como instrumentos ms eficaces para hace frente a los desafos crecientes a los que debe enfrentarse la sociedad en general y la de la Isla en particular,10 de noviembre de 2024,4
Javier Jimnez bilogo La Albufera ha salvado vidas la negacin del cambio climtico es una aberracin,La Albufera ha salvado vidas en el Saler no ha habido ni un charco El bilogo con aos de experiencia en el Parque Natural de la Albufera Javier Jimnez Romo se ha expresado en estos trminos sobre la importancia de este ecosistema no solo como pulmn verde y nicho de biodiversidad sino tambin como amortiguador en caso de episodios de fuertes lluvias Sin embargo ante un fenmeno tan extremo como el pasado  de octubre se convierte tambin en el depsito de todos los residuos que arrastr la barrancada en su destructivo camino por el barranco del Poyo desde Chiva hasta el mismo lago Una situacin que preocupa a los expertos y ambientalistas por el estado de deterioro en el que ha quedado Tal y como explica Jimnez lo primero es el drama humano que la gente pueda ir recuperando poco a poco sus vidas pero despus habr que hacer un anlisis pormenorizado porque la cantidad de residuos que han llegado ha sido terrible una mezcla de vegetacin con plsticos residuos peligrosos y fangos que ser difcil de retirar El bilogo comenta que la tromba de agua ha recogido todo lo que ha arrasado a su paso de viviendas fbricas naves industriales y vehculos y todo eso ha acabado en los arrozales en la Albufera o en el mar si ya estbamos preocupados por la situacin del lago antes de la DANA ahora ya es brutal Sobre la posible contaminacin del agua o de los sedimentos afirma que ya habr tiempo para estudiar los impactos cuando se solucione el drama humano pero que se intuye que son de dimensiones alarmantes Lo principal y lo que ms preocupa son los plsticos y envases con medicamentos y residuos peligrosos por su dispersin y complejidad para retirarlos Va a ser el momento de planificar un reseteo completo un plan de recuperacin y de accin especfico para todo el parque natural Segn Jimnez necesitamos la Albufera porque ha salvado vidas como necesitamos los ros y los barrancos porque todo forma parte de un sistema y todos formamos parte de ese sistema y aade La negacin del cambio climtico es una aberracin y la inaccin ante el cambio climtico es un problema gravsimo Si lo reconocemos hay que tomar medidas reales para adaptarse Hace dcadas que nos haban dicho que un evento as se poda producir los expertos ya han dicho que el Mediterrneo est en el ojo del huracn Eva Tudela es experta y representante de Acci EcologistaAgr entidad que gestiona el Tancat de la Pipa y comenta su primera impresin tras visitar la zona del puerto de Catarroja De momento las acequias que estn muy llenas estn desaguando en campos de arroz y alguna tambin en la Albufera En un primer momento eso sera lo ideal porque si llevan aceites o algn producto es mejor que se queden en la tierra de los arrozales que hacen de filtro verde y no vayan directamente a la Albufera De todas formas los barrancos estn soltando agua hacia la Albufera algunos es cierto que muy contaminada en la zona afectada de Paiporta Sedav y Alfafar Por eso lo que te encuentras en la parte norte del lago es un mar de caas mezcladas con plsticos porque los residuos orgnicos se desharn pero el plstico no Siempre que surge un desastre como este el buen periodismo se convierte en otro bien de primera necesidad porque nuestro trabajo ya no solo consiste en contar bien lo que est pasando sino tambin combatir el fango de los bulos y la desinformacin que siempre abundan alrededor de estas tragediasPor eso desde la edicin de Comunitat Valenciana queremos pedir tu apoyo para hacer frente a las presiones polticas que aumentan todava ms cuando los fallos de gestin tienen consecuencias tan tremendasApoya el periodismo independiente apoya a la edicin elDiarioes Comunitat Valenciana Segn Tudela lo ms complicado va a ser quitar los residuos que no se ven a primera vista como las manchas de aceite de algn coche de refrigerantes estn flotando por la Albufera porque la cantidad es desbordante si no se hace nada se va a convertir la Albufera en basurero lquido de residuos urbanos sobre todo plstico y acompaantes Por su parte Ignacio Moncho tcnico de la Fundacin Assut califica a situacin del Parque Natural de catastrfica un desastre pese a que an no hay una valoracin oficial y asegura que calcular las consecuencias es complicado pero con todo asegura que es recuperable Es un sistema reversible con una gran capacidad de resiliencia va a costar tiempo pero habr que hacerlo El principal problema sern los residuos slidos plsticos metales metales y todo lo que ha arrastrado el agua los sedimentos son ms sencillos de eliminar mediante dragas,9 de noviembre de 2024,10
Trump llega a la Casa Blanca dispuesto a demoler la lucha contra el cambio climtico,Washington  nov EFE Donald Trump regresa a la Casa Blanca en enero con la intencin de demoler los cimientos de las actuales polticas medioambientales de Estados Unidos favorecer los combustibles fsiles y abandonar cualquier tipo de liderazgo internacional en la lucha contra el cambio climtico Su victoria en las elecciones estadounidenses del martes se produjo pocos das antes de que el mundo inicie el  de noviembre en Azerbaiyn la COP la reunin de la ONU para avanzar los objetivos de la lucha global contra la crisis climtica Y la segunda presidencia del poltico republicano es una de las peores noticias que muchos delegados de COP queran escuchar la llegada al poder de un negacionista del cambio climtico En  durante su primer mandato  Trump retir a EEUU del Acuerdo de Pars al rechazar la ciencia y calificar la crisis climtica como un fraude Cuatro aos despus sus opiniones no slo no han cambiado sino que su negacionismo se ha visto reforzado El negacionsimo climtico de Trump En agosto de este ao durante una entrevista con el empresario Elon Musk en la red social X Trump expres su rechazo frontal a la lucha contra el cambio climtico Lo que no entiendo es que la gente hable de calentamiento global o cambio climtico pero nunca hable del calentamiento nuclear explic en referencia al arsenal de armas nucleares que poseen varios pases Para m el gran problema no es el cambio climtico No lo es Todo es un problema pero son grados Para m el gran problema es el poder nuclear El poder nuclear es tan grande aadi entre palabras de aprobacin de Musk El Proyecto  redactado por el laboratorio conservador Heritage Foundation y que es considerado por numerosos analistas como la gua de ruta para la segunda presidencia de Trump dedica un captulo a la Agencia de Proteccin Medioambiental EPA en ingls una de las principales herramientas de Washington para luchar contra la crisis climtica Proyecto  acusa a EPA de ser un caldo de cultivo para la expansin de la influencia y el control del Gobierno federal en toda la economa infiltrada por activistas que ignoran la voluntad del Congreso por lo que plantea una radical reestructuracin para volver a lo bsico que se ejecutar el primer da de Trump en la Casa Blanca con una orden ejecutiva Fiel a su papel como material explosivo para demoler la arquitectura reguladora de Estados Unidos el texto tambin aboga por la desaparicin de la Administracin Nacional Oceanogrfica y Atmosfrica NOAA en ingls que entre otras misiones estudia el clima y vigila los ocanos La guerra de guerrillas medioambientalista Aunque Trump se quiso distanciar del Proyecto  durante la campaa electoral pocos dudan que el republicano deshar tanto como pueda el andamiaje legislativo y normativo que constrie a los sectores ms contaminantes y favorece la economa verde En octubre en un mitin el entonces candidato asegur que en cuanto vuelva al poder el  de enero van a perforar cario perforar en referencia a la expansin del sector petrolfero El republicano tambin quiere cancelar la Ley de Reduccin de la Inflacin del actual presidente Joe Biden que destina centenares de miles de millones de dlares a descarbonizar la economa del pas Pero una cosa son las intenciones y otra los hechos El movimiento medioambientalista estadounidense ya tiene una estrategia para intentar parar los pies a Trump Bsicamente una guerra de guerrillas jurdica En la primera presidencia de Trump Sierra Club present ms de  demandas judiciales que bloquearon muchos de sus intentos de eliminar las protecciones medioambientales declar el jueves en una rueda de prensa Ben Jealous director ejecutivo de Sierra Club Nuestra operacin no slo est preparada sino que ya est en marcha para asegurar que quienes intentan abusar del poder del Gobierno tengan que rendir responsabilidades aadi Lderes de otras organizaciones medioambientales tambin destacan que aunque Trump puede sacar de nuevo a EEUU del Acuerdo de Pars su presidencia slo durar cuatro aos y el prximo presidente podr reintegrar al pas en el tratado el primer da de su mandato como ya hizo en  Biden,9 de noviembre de 2024,19
